{
  "$schema": "http://json-schema.org/draft-07/schema#",
  "title": "Song Schema",
  "type": "object",
  "additionalProperties": false,
  "properties": {
    "version": {
      "type": "string",
      "pattern": "^\\d+\\.\\d+\\.\\d+$",
      "default": "0.1.0"
    },
    "contributors": {
      "type": "array",
      "items": {
        "type": "string"
      },
      "minItems": 1
    },
    "title": {
      "type": "string"
    },
    "artists": {
      "type": "array",
      "items": {
        "type": "string"
      },
      "minItems": 1
    },
    "type": {
      "type": "array",
      "items": {
        "type": "string",
        "enum": ["acoustic", "electric"]
      }
    },
    "notes": {
      "type": "array",
      "items": {
        "type": "string"
      }
    },
    "capo": {
      "type": "integer",
      "minimum": 0
    },
    "chordIDs": {
      "type": "array",
      "items": {
        "type": "string"
      },
      "minItems": 1
    },
    "songSegments": {
      "type": "object",
      "additionalProperties": {
        "type": "object",
        "additionalProperties": false,
        "properties": {
          "name": { "type": "string" },
          "type": { "type": "string", "enum": ["chords", "strings", "tabs"] },
          "times": { "type": "number", "default": 1, "minimum": 1 },
          "chunks": {
            "type": "array",
            "items": {
              "type": "object",
              "additionalProperties": false,
              "properties": {
                "times": {
                  "type": "integer",
                  "minimum": 1
                },
                "items": {
                  "type": "array",
                  "items": {
                    "oneOf": [
                      {
                        "type": "object",
                        "additionalProperties": false,
                        "properties": {
                          "align": {
                            "type": "string",
                            "enum": ["center", "flex-start", "flex-end"]
                          },
                          "chordIDs": {
                            "type": "array",
                            "items": {
                              "type": "array",
                              "items": { "type": "string" },
                              "minItems": 1
                            },
                            "minItems": 1
                          },
                          "chordTimes": {
                            "type": "integer",
                            "minimum": 1,
                            "default": 1
                          },
                          "strummingPattern": {
                            "type": "array",
                            "items": {
                              "type": "string",
                              "enum": ["D", "U", "-", "Dx", "Ux", "X", "De", "Ue"]
                            },
                            "minItems": 1
                          }
                        },
                        "required": ["chordIDs", "chordTimes", "strummingPattern"]
                      },
                      {
                        "oneOf": [
                          {
                            "type": "string",
                            "enum": ["-", "|"]
                          },
                          {
                            "type": "object",
                            "additionalProperties": false,
                            "properties": {
                              "E": { "type": ["integer", "string"], "minimum": 0 },
                              "A": { "type": ["integer", "string"], "minimum": 0 },
                              "D": { "type": ["integer", "string"], "minimum": 0 },
                              "G": { "type": ["integer", "string"], "minimum": 0 },
                              "B": { "type": ["integer", "string"], "minimum": 0 },
                              "e": { "type": ["integer", "string"], "minimum": 0 }
                            }
                          }
                        ]
                      }
                    ]
                  }
                }
              },
              "required": ["times", "items"]
            }
          }
        },
        "required": ["name", "type", "times", "chunks"]
      }
    },
    "songSegmentsOrder": {
      "type": "array",
      "items": {
        "type": "string"
      },
      "minItems": 1
    },
    "resources": {
      "type": "array",
      "items": {
        "type": "object",
        "additionalProperties": false,
        "properties": {
          "alias": {
            "type": "string",
            "pattern": ".+"
          },
          "author": {
            "type": "string",
            "pattern": ".+"
          },
          "link": {
            "type": "string",
            "anyOf": [{ "format": "uri" }, { "pattern": "^\\{book-of-frets\\}#/.*" }]
          }
        },
        "required": ["alias", "author", "link"]
      }
    }
  },
  "required": [
    "version",
    "contributors",
    "title",
    "artists",
    "type",
    "notes",
    "capo",
    "chordIDs",
    "songSegments",
    "songSegmentsOrder",
    "resources"
  ]
}
