{
  "version": "0.4.0",
  "contributors": ["TheAncientOwl"],
  "title": "Sweater Weather",
  "artists": ["The Neighbourhood"],
  "type": ["acoustic"],
  "notes": [],
  "capo": 3,
  "chordIDs": ["C", "Am", "Em", "G", "D"],
  "songSegments": {
    "verse": {
      "name": "verse",
      "type": "chords",
      "times": 1,
      "chunks": [
        {
          "times": 4,
          "items": [
            {
              "chordIDs": [["C", "Am", "Em"]],
              "chordTimes": 1,
              "strummingPattern": ["D", "-", "D", "U", "-", "U", "D", "U"]
            },
            {
              "chordIDs": [["Am", "G"]],
              "chordTimes": 1,
              "strummingPattern": ["D", "-", "D", "U"]
            }
          ]
        }
      ]
    },
    "pre-chorus": {
      "name": "pre-chorus",
      "type": "chords",
      "times": 1,
      "chunks": [
        {
          "times": 2,
          "items": [
            {
              "chordIDs": [["C", "Am", "Em", "G"]],
              "chordTimes": 1,
              "strummingPattern": ["D", "-", "D", "U", "-", "U", "D", "U"]
            }
          ]
        }
      ]
    },
    "chorus": {
      "name": "chorus",
      "type": "chords",
      "times": 1,
      "chunks": [
        {
          "times": 3,
          "items": [
            {
              "chordIDs": [["C", "Am", "Em", "G"]],
              "chordTimes": 1,
              "strummingPattern": ["D"]
            }
          ]
        }
      ]
    },
    "chorus2": {
      "name": "chorus 2",
      "type": "chords",
      "times": 1,
      "chunks": [
        {
          "times": 4,
          "items": [
            {
              "chordIDs": [["C", "Am", "Em", "G"]],
              "chordTimes": 1,
              "strummingPattern": ["D"]
            }
          ]
        },
        {
          "times": 1,
          "items": [
            {
              "chordIDs": [["D"]],
              "chordTimes": 1,
              "strummingPattern": ["D"]
            }
          ]
        }
      ]
    },
    "bridge": {
      "name": "bridge",
      "type": "chords",
      "times": 1,
      "chunks": [
        {
          "times": 2,
          "items": [
            {
              "chordIDs": [["Am", "G", "D", "D"]],
              "chordTimes": 1,
              "strummingPattern": ["D", "-", "D", "-", "-", "U", "D", "U"]
            }
          ]
        },
        {
          "times": 4,
          "items": [
            {
              "chordIDs": [["Am", "G", "D", "D"]],
              "chordTimes": 1,
              "strummingPattern": ["D", "-", "D", "-", "-", "U", "D", "U"]
            }
          ]
        }
      ]
    },
    "chorus3": {
      "name": "chorus 3",
      "type": "chords",
      "times": 1,
      "chunks": [
        {
          "times": 4,
          "items": [
            {
              "chordIDs": [["C", "Am", "Em", "G"]],
              "chordTimes": 1,
              "strummingPattern": ["D", "-", "D", "-", "D", "U", "D", "U"]
            }
          ]
        }
      ]
    },
    "outro": {
      "name": "outro",
      "type": "chords",
      "times": 1,
      "chunks": [
        {
          "times": 4,
          "items": [
            {
              "chordIDs": [["C", "Am", "Em", "G"]],
              "chordTimes": 1,
              "strummingPattern": ["D"]
            }
          ]
        }
      ]
    }
  },
  "songSegmentsOrder": [
    "verse",
    "pre-chorus",
    "chorus",
    "verse",
    "pre-chorus",
    "chorus2",
    "bridge",
    "chorus3",
    "outro"
  ],
  "resources": [
    {
      "alias": "Sweater Weather Guitar Tutorial - The Neighbourhood Guitar Lesson |Chords + Guitar Cover|",
      "author": "GuitarZero2Hero ~ YouTube",
      "link": "https://www.youtube.com/watch?v=kvGorssKuO8"
    },
    {
      "alias": "Sweater Weather Guitar Cover Acoustic - The Neighborhood + Onscreen Chords",
      "author": "GuitarZero2Hero Express ~ YouTube",
      "link": "https://youtu.be/HcCzuFIOKFw"
    }
  ]
}
