{
  "version": "0.4.0",
  "contributors": ["TheAncientOwl"],
  "title": "Flowers Need Rain",
  "artists": ["Preston Pablo"],
  "type": ["acoustic", "electric"],
  "notes": [],
  "capo": 0,
  "chordIDs": ["-"],
  "songSegments": {
    "main": {
      "name": "main",
      "type": "strings",
      "times": 1,
      "chunks": [
        {
          "times": 404,
          "items": [
            "-",
            { "E": 9, "A": 9 },
            { "E": 9, "A": 9 },
            { "E": 9, "A": 9 },
            { "E": 9, "A": 9 },
            "-",
            { "E": 6, "A": 6 },
            { "E": 6, "A": 6 },
            { "E": 6, "A": 6 },
            { "E": 6, "A": 6 },
            "-",
            { "E": 12, "A": 13 },
            { "E": 12, "A": 13 },
            { "E": 12, "A": 13 },
            { "E": 12, "A": 13 },
            "-",
            { "E": 7, "A": 8 },
            { "E": 7, "A": 8 },
            { "E": 7, "A": 8 },
            { "E": 7, "A": 8 },
            {}
          ]
        }
      ]
    }
  },
  "songSegmentsOrder": ["main"],
  "resources": [
    {
      "alias": "How to play Flowers Need Rain by Preston Pablo",
      "author": "Elijah Plays ~ YouTube",
      "link": "https://youtu.be/Bl4FiG65g1A"
    }
  ]
}
