{
  "version": "0.1.0",
  "contributors": ["TheAncientOwl"],
  "title": "Viva La Vida",
  "artists": ["Coldplay"],
  "type": ["acoustic"],
  "notes": [],
  "capo": 1,
  "chordIDs": ["C", "D", "G", "Em"],
  "songSegments": {
    "verse-palm-muted": {
      "name": "verse palm muted",
      "type": "chords",
      "times": 1,
      "chunks": [
        {
          "times": 1,
          "items": [
            {
              "chordIDs": ["C"],
              "chordTimes": 1,
              "strummingPattern": ["D", "De", "D", "De", "D", "D"]
            },
            {
              "chordIDs": ["D"],
              "chordTimes": 1,
              "strummingPattern": ["De", "D", "De", "D", "D", "De", "D", "De", "D"]
            }
          ]
        },
        {
          "times": 1,
          "items": [
            {
              "chordIDs": ["G"],
              "chordTimes": 1,
              "strummingPattern": ["D", "De", "D", "De", "D", "D"]
            },
            {
              "chordIDs": ["Em"],
              "chordTimes": 1,
              "strummingPattern": ["De", "D", "De", "D", "D", "De", "D", "De", "D"]
            }
          ]
        }
      ]
    },
    "verse": {
      "name": "verse",
      "type": "chords",
      "times": 8,
      "chunks": [
        {
          "times": 1,
          "items": [
            {
              "chordIDs": ["C"],
              "chordTimes": 1,
              "strummingPattern": ["D", "-", "D", "-", "D", "U", "D"]
            },
            {
              "chordIDs": ["D"],
              "chordTimes": 1,
              "strummingPattern": ["U", "-", "U", "D", "U", "-", "U", "D", "U"]
            }
          ]
        },
        {
          "times": 1,
          "items": [
            {
              "chordIDs": ["G"],
              "chordTimes": 1,
              "strummingPattern": ["D", "-", "D", "-", "D", "U", "D"]
            },
            {
              "chordIDs": ["Em"],
              "chordTimes": 1,
              "strummingPattern": ["U", "-", "U", "D", "U", "-", "U", "D", "U"]
            }
          ]
        }
      ]
    },
    "chorus-1": {
      "name": "chorus",
      "type": "chords",
      "times": 4,
      "chunks": [
        {
          "times": 1,
          "items": [
            {
              "chordIDs": ["C"],
              "chordTimes": 1,
              "strummingPattern": ["D", "-", "D", "-", "D", "U", "D"]
            },
            {
              "chordIDs": ["D"],
              "chordTimes": 1,
              "strummingPattern": ["U", "-", "U", "D", "U", "-", "U", "D", "U"]
            }
          ]
        },
        {
          "times": 1,
          "items": [
            {
              "chordIDs": ["G"],
              "chordTimes": 1,
              "strummingPattern": ["D", "-", "D", "-", "D", "U", "D"]
            },
            {
              "chordIDs": ["Em"],
              "chordTimes": 1,
              "strummingPattern": ["U", "-", "U", "D", "U", "-", "U", "D", "U"]
            }
          ]
        }
      ]
    },
    "chorus-2": {
      "name": "chorus",
      "type": "chords",
      "times": 1,
      "chunks": [
        {
          "times": 1,
          "items": [
            {
              "chordIDs": ["C"],
              "chordTimes": 1,
              "strummingPattern": ["D", "-", "D", "-", "D", "U", "D"]
            },
            {
              "chordIDs": ["D"],
              "chordTimes": 1,
              "strummingPattern": ["U", "-", "U", "D", "U", "-", "U", "D", "U"]
            }
          ]
        },
        {
          "times": 1,
          "items": [
            {
              "chordIDs": ["G"],
              "chordTimes": 1,
              "strummingPattern": ["D", "-", "D", "-", "D", "U", "D"]
            },
            {
              "chordIDs": ["Em"],
              "chordTimes": 1,
              "strummingPattern": ["U", "-", "U", "D", "U", "-", "U", "D", "U"]
            }
          ]
        }
      ]
    },
    "build-up": {
      "name": "build up",
      "type": "chords",
      "times": 1,
      "chunks": [
        {
          "times": 1,
          "items": [
            {
              "chordIDs": ["C"],
              "chordTimes": 1,
              "strummingPattern": ["D", "-", "D", "-", "D", "U", "D"]
            },
            {
              "chordIDs": ["Em"],
              "chordTimes": 1,
              "strummingPattern": ["U", "-", "U", "D", "U", "-", "U", "D", "U"]
            }
          ]
        },
        {
          "times": 1,
          "items": [
            {
              "chordIDs": ["D"],
              "chordTimes": 1,
              "strummingPattern": ["D", "-", "D", "-", "D", "U", "D"]
            },
            {
              "chordIDs": ["D"],
              "chordTimes": 1,
              "strummingPattern": ["U", "-", "U", "D", "U", "-", "U", "D", "U"]
            }
          ]
        }
      ]
    },
    "chorus-3": {
      "name": "chorus",
      "type": "chords",
      "times": 5,
      "chunks": [
        {
          "times": 1,
          "items": [
            {
              "chordIDs": ["C"],
              "chordTimes": 1,
              "strummingPattern": ["D", "-", "D", "-", "D", "U", "D"]
            },
            {
              "chordIDs": ["D"],
              "chordTimes": 1,
              "strummingPattern": ["U", "-", "U", "D", "U", "-", "U", "D", "U"]
            }
          ]
        },
        {
          "times": 1,
          "items": [
            {
              "chordIDs": ["G"],
              "chordTimes": 1,
              "strummingPattern": ["D", "-", "D", "-", "D", "U", "D"]
            },
            {
              "chordIDs": ["Em"],
              "chordTimes": 1,
              "strummingPattern": ["U", "-", "U", "D", "U", "-", "U", "D", "U"]
            }
          ]
        }
      ]
    },
    "outro": {
      "name": "outro",
      "type": "chords",
      "times": 1,
      "chunks": [
        {
          "times": 1,
          "items": [
            {
              "chordIDs": ["C", "D", "G", "Em"],
              "chordTimes": 1,
              "strummingPattern": ["D"]
            }
          ]
        }
      ]
    }
  },
  "songSegmentsOrder": [
    "verse-palm-muted",
    "verse",
    "chorus-1",
    "verse",
    "chorus-2",
    "build-up",
    "chorus-3",
    "outro"
  ],
  "resources": [
    {
      "alias": "Viva La Vida Guitar Tutorial ðŸŽ¸ Coldplay Guitar Lesson |Easy + Live Version Chords + TAB|",
      "author": "GuitarZero2Hero ~ YouTube",
      "link": "https://www.youtube.com/watch?v=EgnNfb4f2TU"
    },
    {
      "alias": "Viva La Vida Guitar Cover Coldplay ðŸŽ¸|Tabs + Chords|",
      "author": "GuitarZero2Hero Express ~ YouTube",
      "link": "https://youtu.be/lhR434nrXK4"
    }
  ]
}
