{
  "version": "0.2.0",
  "contributors": ["TheAncientOwl"],
  "title": "Jingle Bell Rock",
  "artists": ["Bobby Helms"],
  "type": ["acoustic"],
  "notes": [],
  "capo": 0,
  "chordIDs": ["D", "DM7", "D6", "D#dim7", "Em7", "A7", "D7", "G#dim7", "E7", "A", "G", "Gm"],
  "songSegments": {
    "intro": {
      "name": "intro",
      "type": "strings",
      "times": 1,
      "chunks": [
        {
          "times": 1,
          "items": [
            "|",
            "-",
            { "G": 7, "B": 7 },
            "-",
            { "G": 7, "B": 7 },
            "-",
            { "G": 7, "B": 7 },
            "-",
            "-",
            "-",
            { "G": 6, "B": 7 },
            "-",
            { "G": 6, "B": 7 },
            "-",
            { "G": 6, "B": 7 },
            "-",
            "-",
            "-",
            "|",
            "-",
            { "B": 7 },
            "-",
            { "e": 5 },
            "-",
            { "G": 7 },
            "-",
            { "B": 5 },
            "-",
            { "B": 5 },
            { "B": 6 },
            "-",
            { "B": 5 },
            "-",
            { "G": 7 },
            "-",
            { "G": 4 },
            "-",
            "|",
            "-",
            { "D": 7 },
            "-",
            "-",
            "-",
            "-",
            "-",
            "-",
            "-",
            "-",
            "-",
            "-",
            "-",
            "-",
            "-",
            "-",
            "-",
            "|",
            "-",
            "-",
            "-",
            { "E": 5 },
            "-",
            { "E": 3 },
            "-",
            "-",
            "-",
            { "E": 2 },
            "-",
            "-",
            "-",
            { "E": 0 },
            "-",
            "-",
            "-",
            "|"
          ]
        }
      ]
    },
    "verse-1": {
      "name": "verse 1",
      "type": "chords",
      "times": 1,
      "chunks": [
        {
          "times": 1,
          "items": [
            {
              "chordIDs": [
                ["D", "DM7", "|", "D6", "D"],
                ["D6", "D#dim7", "|", "Em7", "A7"],
                ["Em7", "A7", "|", "Em7", "A7"],
                ["Em7", "A7"]
              ],
              "chordTimes": 1,
              "strummingPattern": ["D", "U", "D", "U"]
            }
          ]
        }
      ]
    },
    "verse-2": {
      "name": "verse 2",
      "type": "chords",
      "times": 1,
      "chunks": [
        {
          "times": 1,
          "items": [
            {
              "chordIDs": [
                ["D", "DM7", "|", "D6", "D"],
                ["D6", "D#dim7", "|", "Em7", "A7"],
                ["Em7", "A7", "|", "Em7", "A7"],
                ["Em7", "A7", "|", "D", "D7"]
              ],
              "chordTimes": 1,
              "strummingPattern": ["D", "U", "D", "U"]
            }
          ]
        }
      ]
    },
    "chorus": {
      "name": "chorus",
      "type": "chords",
      "times": 1,
      "chunks": [
        {
          "times": 1,
          "items": [
            {
              "chordIDs": [
                ["G", "G#dim7", "D", "D"],
                ["E7", "E7"]
              ],
              "chordTimes": 4,
              "strummingPattern": ["D", "U"]
            }
          ]
        },
        {
          "times": 1,
          "items": [
            {
              "chordIDs": [["A"]],
              "chordTimes": 1,
              "strummingPattern": ["D"]
            }
          ]
        }
      ]
    },
    "chorus-riff": {
      "name": "chorus riff",
      "type": "strings",
      "times": 1,
      "chunks": [
        {
          "times": 1,
          "items": [
            "|",
            "-",
            "-",
            "-",
            { "E": 5 },
            "-",
            { "E": 3 },
            "-",
            "-",
            "-",
            { "E": 2 },
            "-",
            "-",
            "-",
            { "E": 0 },
            "-",
            "-",
            "-",
            "|"
          ]
        }
      ]
    },
    "post-chorus-1": {
      "name": "post chorus 1",
      "type": "chords",
      "times": 1,
      "chunks": [
        {
          "times": 1,
          "items": [
            {
              "chordIDs": [
                ["D", "DM7", "|", "D6", "D"],
                ["D6", "B7"],
                ["G", "Gm"],
                ["Em7", "A7", "D"]
              ],
              "chordTimes": 1,
              "strummingPattern": ["D", "U", "D", "U"]
            }
          ]
        }
      ]
    },
    "verse-3": {
      "name": "verse 3",
      "type": "chords",
      "times": 1,
      "chunks": [
        {
          "times": 1,
          "items": [
            {
              "chordIDs": [["D", "DM7"]],
              "chordTimes": 1,
              "strummingPattern": ["D", "U", "D", "U"]
            },
            {
              "chordIDs": [["D6", "D"]],
              "chordTimes": 1,
              "strummingPattern": ["D", "U", "D", "U"]
            }
          ]
        },
        {
          "times": 1,
          "items": [
            {
              "chordIDs": [["D6", "D#dim7"]],
              "chordTimes": 1,
              "strummingPattern": ["D", "U", "D", "U"]
            },
            {
              "chordIDs": [["Em7", "A7"]],
              "chordTimes": 1,
              "strummingPattern": ["D", "U", "D", "U"]
            }
          ]
        },
        {
          "times": 1,
          "items": [
            {
              "chordIDs": [["Em7", "A7"]],
              "chordTimes": 1,
              "strummingPattern": ["D", "U", "D", "U"]
            },
            {
              "chordIDs": [["Em7", "A7"]],
              "chordTimes": 1,
              "strummingPattern": ["D", "U", "D", "U"]
            }
          ]
        },
        {
          "times": 1,
          "items": [
            {
              "chordIDs": [["Em7", "A7"]],
              "chordTimes": 1,
              "strummingPattern": ["D", "U", "D", "U"]
            },
            {
              "chordIDs": [["D", "D7"]],
              "chordTimes": 1,
              "strummingPattern": ["D", "U", "D", "U"]
            }
          ]
        }
      ]
    },
    "post-chorus-2": {
      "name": "post chorus 2",
      "type": "chords",
      "times": 1,
      "chunks": [
        {
          "times": 1,
          "items": [
            {
              "chordIDs": [
                ["D", "DM7", "|", "D6", "D"],
                ["D6", "B7"],
                ["G", "Gm"],
                ["Em7", "A7", "|", "Em7", "A7"],
                ["Em7", "A7", "D"]
              ],
              "chordTimes": 1,
              "strummingPattern": ["D", "U", "D", "U"]
            }
          ]
        },
        {
          "times": 1,
          "items": [
            {
              "chordIDs": [["D"]],
              "chordTimes": 1,
              "strummingPattern": ["D", "U", "D", "U", "-", "-", "D", "-"]
            }
          ]
        }
      ]
    }
  },
  "songSegmentsOrder": [
    "intro",
    "verse-1",
    "verse-2",
    "chorus",
    "chorus-riff",
    "post-chorus-1",
    "chorus",
    "chorus-riff",
    "post-chorus-2"
  ],
  "resources": [
    {
      "alias": "Jingle Bell Rock Guitar Tutorial Bobbly Helms Acoustic Guitar Lesson |Chords + Strumming|",
      "author": "GuitarZero2Hero ~ YouTube",
      "link": "https://youtu.be/kGE2j5wVs0Q"
    },
    {
      "alias": "Jingle Bell Rock Guitar Cover Bobby Helms ðŸŽ¸|Tabs + Chords|",
      "author": "GuitarZero2Hero Express ~ YouTube",
      "link": "https://youtu.be/zy76BuTfwwE"
    }
  ]
}
