{
  "version": "0.3.0",
  "contributors": ["TheAncientOwl"],
  "title": "Wake Me Up",
  "artists": ["Avicii"],
  "type": ["acoustic"],
  "notes": [],
  "capo": 2,
  "chordIDs": ["Am", "Fmaj7", "G", "C/G", "E"],
  "songSegments": {
    "intro": {
      "name": "intro",
      "type": "chords",
      "times": 1,
      "chunks": [
        {
          "times": 1,
          "items": [
            {
              "chordIDs": ["Am", "Fmaj7", "C/G"],
              "chordTimes": 1,
              "strummingPattern": ["D", "-", "D", "-", "-", "U", "D", "U"]
            },
            {
              "chordIDs": ["C/G", "G"],
              "chordTimes": 1,
              "strummingPattern": ["D", "-", "D", "-", "-", "U", "D", "U"]
            }
          ]
        },
        {
          "times": 1,
          "items": [
            {
              "chordIDs": ["Am", "Fmaj7", "C/G"],
              "chordTimes": 1,
              "strummingPattern": ["D", "-", "D", "-", "-", "U", "D", "U"]
            },
            {
              "chordIDs": ["C/G", "E"],
              "chordTimes": 1,
              "strummingPattern": ["D", "-", "D", "-", "-", "U", "D", "U"]
            }
          ]
        }
      ]
    },
    "chorus": {
      "name": "chorus",
      "type": "chords",
      "times": 1,
      "chunks": [
        {
          "times": 1,
          "items": [
            {
              "chordIDs": ["Am", "Fmaj7", "C/G"],
              "chordTimes": 1,
              "strummingPattern": ["D", "-", "D", "-", "-", "U", "D", "U"]
            },
            {
              "chordIDs": ["C/G", "G"],
              "chordTimes": 1,
              "strummingPattern": ["D", "-", "D", "-", "-", "U", "D", "U"]
            }
          ]
        },
        {
          "times": 1,
          "items": [
            {
              "chordIDs": ["Am", "Fmaj7", "C/G"],
              "chordTimes": 1,
              "strummingPattern": ["D", "-", "D", "-", "-", "U", "D", "U"]
            },
            {
              "chordIDs": ["C/G", "E"],
              "chordTimes": 1,
              "strummingPattern": ["D", "-", "D", "-", "-", "U", "D", "U"]
            }
          ]
        }
      ]
    },
    "dance": {
      "name": "dance",
      "type": "chords",
      "times": 1,
      "chunks": [
        {
          "times": 1,
          "items": [
            {
              "chordIDs": ["Am", "Fmaj7", "C/G"],
              "chordTimes": 1,
              "strummingPattern": ["D", "-", "D", "-", "-", "U", "D", "U"]
            },
            {
              "chordIDs": ["C/G", "G"],
              "chordTimes": 1,
              "strummingPattern": ["D", "-", "D", "-", "-", "U", "D", "U"]
            }
          ]
        },
        {
          "times": 1,
          "items": [
            {
              "chordIDs": ["Am", "Fmaj7", "C/G"],
              "chordTimes": 1,
              "strummingPattern": ["D", "-", "D", "-", "-", "U", "D", "U"]
            },
            {
              "chordIDs": ["C/G", "E"],
              "chordTimes": 1,
              "strummingPattern": ["D", "-", "D", "-", "-", "U", "D", "U"]
            }
          ]
        }
      ]
    },
    "verse": {
      "name": "verse",
      "type": "chords",
      "times": 1,
      "chunks": [
        {
          "times": 1,
          "items": [
            {
              "chordIDs": ["Am", "Fmaj7", "C/G", "C/G"],
              "chordTimes": 1,
              "strummingPattern": ["D", "-", "D", "-", "-", "U", "D", "U"]
            }
          ]
        }
      ]
    }
  },
  "songSegmentsOrder": ["intro", "chorus", "dance", "verse"],
  "resources": [
    {
      "alias": "Wake Me Up Guitar Tutorial - Avicii Guitar Lesson ðŸŽ¸|100% Accurate Chords + Lead + No Capo + Cover|",
      "author": "GuitarZero2Hero ~ YouTube",
      "link": "https://www.youtube.com/watch?v=_u4wlBmXGmw&t=202s"
    },
    {
      "alias": "Wake Me Up Guitar Cover Acoustic - Avicii ðŸŽ¸ |Tabs + Chords|",
      "author": "GuitarZero2Hero Express ~ YouTube",
      "link": "https://www.youtube.com/watch?v=ttQ4zKNH3l0"
    }
  ]
}
