{"version":"0.1.0","contributors":["TheAncientOwl"],"title":"Riptide","artists":["Vance Joy"],"type":["acoustic"],"notes":[],"capo":5,"chordIDs":["Am","G","C","Fmaj7"],"songSegments":{"intro/verse/chorus":{"name":"intro / verse / chorus","type":"chords","times":1,"chunks":[{"times":15,"items":[{"chordIDs":[["Am","G","C","C"]],"chordTimes":1,"strummingPattern":["D","-","D","-","-","U","D","U"]}]}]},"break":{"name":"break","type":"strings","times":4,"chunks":[{"times":1,"items":["|","-",{"B":3},{"B":"h"},{"B":5},"-",{"B":5},{"e":3},"-","-","-","-",{"G":5},"-",{"B":5},"-","-","-","|"]}]},"bridge":{"name":"bridge","type":"chords","times":1,"chunks":[{"times":2,"items":[{"chordIDs":[["Am","G","C","Fmaj7"]],"chordTimes":2,"strummingPattern":["D","-","D","-","-","U","D","U"]}]}]},"post-bridge":{"name":"post bridge","type":"chords","times":1,"chunks":[{"times":2,"items":[{"chordIDs":[["Am","G","C"]],"chordTimes":1,"strummingPattern":["D"]}]}]}},"songSegmentsOrder":["intro/verse/chorus","break","bridge","intro/verse/chorus"],"resources":[{"alias":"Riptide Guitar Tutorial - Vance Joy Guitar Lesson ðŸŽ¸ |Easy Chords + Guitar Cover|","author":"GuitarZero2Hero ~ YouTube","link":"https://youtu.be/no4u0CTAR_Q"},{"alias":"Riptide Guitar Cover Acoustic - Vance Joy ðŸŽ¸ |Chords|","author":"GuitarZero2Hero Express ~ YouTube","link":"https://youtu.be/twmHegxF7Jo"}]}
