{
  "version": "0.1.0",
  "contributors": ["TheAncientOwl"],
  "title": "As It Was",
  "artists": ["Harry Styles"],
  "type": ["acoustic"],
  "notes": [],
  "capo": 0,
  "chordIDs": ["Dsus2", "Bm7", "E", "A"],
  "songSegments": {
    "main-progression": {
      "name": "main progression",
      "type": "chords",
      "times": 1,
      "chunks": [
        {
          "times": 404,
          "items": [
            {
              "chordIDs": ["Dsus2", "Bm7", "E", "A"],
              "chordTimes": 1,
              "strummingPattern": [
                "D",
                "-",
                "D",
                "-",
                "D",
                "U",
                "D",
                "U",
                "-",
                "U",
                "D",
                "-",
                "D",
                "U",
                "D",
                "U"
              ]
            }
          ]
        }
      ]
    }
  },
  "songSegmentsOrder": ["main-progression"],
  "resources": [
    {
      "alias": "As It Was Guitar Tutorial - Harry Styles Guitar Lesson |Chords + Fingerpicking|",
      "author": "GuitarZero2Hero ~ YouTube",
      "link": "https://youtu.be/I-k5YIgPJCM"
    },
    {
      "alias": "As It Was Guitar Cover Harry Styles ðŸŽ¸|Tabs + Chords|",
      "author": "GuitarZero2Hero Express ~ YouTube",
      "link": "https://youtu.be/oLeG9U-6UO8"
    }
  ]
}
