{
  "version": "0.1.0",
  "contributors": ["TheAncientOwl"],
  "title": "Save Your Tears",
  "artists": ["The Weekend", "Ariana Grande"],
  "type": ["acoustic"],
  "notes": [],
  "capo": 0,
  "chordIDs": ["C", "Am", "Em", "G", "Fmaj7"],
  "songSegments": {
    "intro": {
      "name": "intro",
      "type": "chords",
      "times": 1,
      "chunks": [
        {
          "times": 1,
          "items": [
            {
              "chordIDs": ["C"],
              "chordTimes": 4,
              "strummingPattern": [
                "D",
                "-",
                "D",
                "-",
                "De",
                "-",
                "D",
                "-",
                "D",
                "-",
                "D",
                "-",
                "De",
                "-",
                "D",
                "-"
              ]
            }
          ]
        }
      ]
    },
    "verse-1": {
      "name": "verse 1",
      "type": "chords",
      "times": 1,
      "chunks": [
        {
          "times": 8,
          "items": [
            {
              "chordIDs": ["C", "Am", "Em", "G"],
              "chordTimes": 1,
              "strummingPattern": [
                "D",
                "-",
                "D",
                "-",
                "De",
                "-",
                "D",
                "-",
                "D",
                "-",
                "D",
                "-",
                "De",
                "-",
                "D",
                "-"
              ]
            }
          ]
        }
      ]
    },
    "prechorus-1": {
      "name": "prechorus 1",
      "type": "chords",
      "times": 1,
      "chunks": [
        {
          "times": 1,
          "items": [
            {
              "chordIDs": ["Dm", "Am", "Fmaj7", "G"],
              "chordTimes": 1,
              "strummingPattern": [
                "D",
                "-",
                "D",
                "-",
                "De",
                "-",
                "D",
                "-",
                "D",
                "-",
                "D",
                "-",
                "De",
                "-",
                "D",
                "-"
              ]
            }
          ]
        }
      ]
    },
    "chorus-1": {
      "name": "chorus 1",
      "type": "chords",
      "times": 1,
      "chunks": [
        {
          "times": 1,
          "items": [
            {
              "chordIDs": ["C", "Am"],
              "chordTimes": 1,
              "strummingPattern": ["D", "D"]
            },
            {
              "chordIDs": ["Em", "G"],
              "chordTimes": 1,
              "strummingPattern": ["D", "U", "D", "U", "D", "U", "D", "U"]
            }
          ]
        },
        {
          "times": 1,
          "items": [
            {
              "chordIDs": ["C", "Am"],
              "chordTimes": 1,
              "strummingPattern": ["D", "D"]
            },
            {
              "chordIDs": ["Em"],
              "chordTimes": 4,
              "strummingPattern": ["D", "U", "D", "U", "D", "U", "D", "U"]
            },
            {
              "chordIDs": ["Em"],
              "chordTimes": 4,
              "strummingPattern": ["D", "U", "D", "U", "D", "-", "-", "-"]
            }
          ]
        }
      ]
    },
    "verse-2": {
      "name": "verse 2",
      "type": "chords",
      "times": 1,
      "chunks": [
        {
          "times": 4,
          "items": [
            {
              "chordIDs": ["C", "Am", "Em", "G"],
              "chordTimes": 1,
              "strummingPattern": [
                "D",
                "-",
                "D",
                "-",
                "De",
                "-",
                "D",
                "-",
                "D",
                "-",
                "D",
                "-",
                "De",
                "-",
                "D",
                "-"
              ]
            }
          ]
        }
      ]
    },
    "prechorus-2": {
      "name": "prechorus 2",
      "type": "chords",
      "times": 1,
      "chunks": [
        {
          "times": 1,
          "items": [
            {
              "chordIDs": ["Dm", "Am", "Fmaj7"],
              "chordTimes": 1,
              "strummingPattern": [
                "D",
                "-",
                "D",
                "-",
                "De",
                "-",
                "D",
                "-",
                "D",
                "-",
                "D",
                "-",
                "De",
                "-",
                "D",
                "-"
              ]
            }
          ]
        },
        {
          "times": 1,
          "items": [
            {
              "chordIDs": ["F", "G"],
              "chordTimes": 1,
              "strummingPattern": ["D", "-", "D", "-", "D", "-", "D", "-"]
            }
          ]
        },
        {
          "times": 1,
          "items": [
            {
              "chordIDs": ["Dm", "Am", "Fmaj7", "G"],
              "chordTimes": 1,
              "strummingPattern": [
                "D",
                "-",
                "D",
                "-",
                "De",
                "-",
                "D",
                "-",
                "D",
                "-",
                "D",
                "-",
                "De",
                "-",
                "D",
                "-"
              ]
            }
          ]
        }
      ]
    },
    "bridge": {
      "name": "bridge",
      "type": "chords",
      "times": 1,
      "chunks": [
        {
          "times": 2,
          "items": [
            {
              "chordIDs": ["C", "Am", "Em", "G"],
              "chordTimes": 1,
              "strummingPattern": ["D"]
            }
          ]
        }
      ]
    },
    "chorus-2": {
      "name": "chorus 2",
      "type": "chords",
      "times": 1,
      "chunks": [
        {
          "times": 4,
          "items": [
            {
              "chordIDs": ["C", "Am", "Em", "G"],
              "chordTimes": 1,
              "strummingPattern": ["D", "U", "D", "U", "D", "U", "D", "U"]
            }
          ]
        }
      ]
    }
  },
  "songSegmentsOrder": [
    "intro",
    "verse-1",
    "prechorus-1",
    "chorus-1",
    "verse-2",
    "prechorus-2",
    "chorus-1",
    "bridge",
    "chorus-2"
  ],
  "resources": [
    {
      "alias": "Save Your Tears Guitar Tutorial The Weeknd Guitar Lesson |Easy Chords|",
      "author": "GuitarZero2Hero ~ YouTube",
      "link": "https://youtu.be/aPuujELV4Hg"
    },
    {
      "alias": "Save Your Tears Guitar Cover The Weeknd ðŸŽ¸|Tabs + Chords|",
      "author": "GuitarZero2Hero Express ~ YouTube",
      "link": "https://youtu.be/NF-gjc8-fz0?"
    }
  ]
}
